{
  "$schema": "./docs/state.schema.json",
  "project": "ReBoard SaaS platformu",
  "updated_at": "2026-10-29T00:35:00+03:00",
  "current_phase": "F2",
  "deadlines": {
    "demo_freeze": "2026-10-29T18:00:00+03:00",
    "competition": "2026-10-30T09:00:00+03:00"
  },
  "goals": [
    "Atık tekstil satıcıları ile alıcılarını pazar yerinde buluşturmak",
    "Tedarik zincirinin aksamaması: stok, kaç günlük hammadde kaldığı, teslimler, uyarılar",
    "Geri kazanılan atık miktarını doğrulanabilir biçimde göstererek güven kazanmak"
  ],
  "phases": [
    {
      "id": "F0",
      "title": "Kurulum",
      "window": "2026-10-27"
    },
    {
      "id": "F1",
      "title": "Alan çekirdeği",
      "window": "2026-10-27/2026-10-28"
    },
    {
      "id": "F2",
      "title": "Ekranlar",
      "window": "2026-10-28"
    },
    {
      "id": "F3",
      "title": "Hikâye (kare dizisi)",
      "window": "2026-10-27/2026-10-29"
    },
    {
      "id": "F4",
      "title": "Yayın ve demo",
      "window": "2026-10-29/2026-10-30"
    },
    {
      "id": "F5",
      "title": "Yarışma sonrası ürünleşme",
      "window": "2026-11"
    }
  ],
  "tasks": [
    {
      "id": "T0.1",
      "phase": "F0",
      "mode": "hibrit",
      "status": "tamam",
      "title": "Araç kurulumu: Node 24 LTS, pnpm, ffmpeg, Blender LTS",
      "acceptance": "node, pnpm, ffmpeg ve blender sürüm komutları çalışır",
      "evidence": "node v24.22.1, pnpm 10.34.9, ffmpeg 9.0.1 essentials, Blender 4.5.10 LTS (winget)",
      "depends_on": [],
      "decisions": [
        "D-004",
        "D-007"
      ]
    },
    {
      "id": "T0.2",
      "phase": "F0",
      "mode": "otonom",
      "status": "tamam",
      "title": "git init, .gitignore, belge seti, docs:check, Stop kancası, bellek",
      "acceptance": "pnpm docs:check yeşil; kaynak belgeler git status'ta görünmez; Stop kancası src değişip state.json değişmediğinde durdurur",
      "evidence": "docs:check yeşil (31 görev, 18 karar, 18 metrik); bilinçli bozma 4/4 yakalandı (bilinmeyen karar, eksik belge, fazladan metrik, şema ihlali); git check-ignore .private ve .env.local'ı dışlıyor; docs-guard: kod değişip state.json değişmeyince exit 2, diğer 4 durumda exit 0",
      "depends_on": [],
      "decisions": [
        "D-006",
        "D-017"
      ]
    },
    {
      "id": "T0.3",
      "phase": "F0",
      "mode": "hibrit",
      "status": "tamam",
      "title": "GitHub deposu MaNga-003/reboard (public) ve ilk push",
      "acceptance": "gh repo view MaNga-003/reboard açık; main dalı push edildi",
      "evidence": "https://github.com/MaNga-003/reboard (public, MaNga-003 org); main push edildi; LICENSE: tüm hakları saklı (D-019); geçmişteki 5 commit mesajından Claude atfı silindi, ağaçlar birebir aynı, katkıcı listesinde yalnızca ekip (D-020, M-19)",
      "depends_on": [
        "T0.2"
      ],
      "decisions": [
        "D-006",
        "D-019",
        "D-020"
      ]
    },
    {
      "id": "T0.4",
      "phase": "F0",
      "mode": "hibrit",
      "status": "tamam",
      "title": "Vercel ve Neon girişi (kullanıcı), proje, Frankfurt bölgesi ve ortam değişkenleri (Claude)",
      "acceptance": "Vercel projesi fra1'de; Neon projesi aws-eu-central-1'de; DATABASE_URL ve BETTER_AUTH_SECRET Vercel'de tanımlı",
      "evidence": "Neon fragrant-rain-02230008 (aws-eu-central-1, Postgres 18): migrasyonlar uygulandı, 28 tablo, 2 tetikleyici; UPDATE, DELETE ve TRUNCATE geri alınan işlemde reddedildi. Vercel reboard (burak-siscis-projects): fonksiyonlar fra1, durum Ready, https://reboard-lovat.vercel.app. DATABASE_URL ve BETTER_AUTH_SECRET gizli değişken (Production, Preview); BETTER_AUTH_URL canlı adres. Yüklenen 67 dosyanın 0'ı hassas. GitHub bağlantısı kurulamadı (Vercel GitHub uygulaması MaNga-003'te yok); yayın CLI ile. Canlı denetim GitHub Actions'tan 8/8 (çalıştırma 40420750548): / → /tr 307, /tr ve /en 200, /api/auth/ok 200, fonksiyon bölgesi fra1, 3 güvenlik başlığı.",
      "depends_on": [
        "T0.3"
      ],
      "decisions": [
        "D-003"
      ]
    },
    {
      "id": "T0.5",
      "phase": "F0",
      "mode": "otonom",
      "status": "tamam",
      "title": "Next.js iskeleti, Tailwind, tasarım tokenları, next-intl, Drizzle ve PGlite, Better Auth, Vitest, Playwright, CI",
      "acceptance": "pnpm build, pnpm lint, pnpm typecheck ve pnpm test yeşil; /tr ve /en açılır",
      "evidence": "pnpm lint 0 hata; pnpm typecheck (next typegen + tsc) 0 hata; pnpm test 20/20 (renk ölçümleri color_metrics.py ile çapraz, Better Auth şema eşleşmesi, TR/EN anahtar eşitliği (20/20), PGlite migrasyonu); pnpm build temiz; pnpm test:e2e 14/14 (/ → /tr, /tr ve /en, axe 0 ciddi ihlal, 360–1440 px taşma 0, e-postayla kayıt PGlite'a yazar); bilinçli bozma 2/2 yakalandı; CI .github/workflows/ci.yml",
      "depends_on": [],
      "decisions": [
        "D-005",
        "D-007",
        "D-008",
        "D-009",
        "D-010"
      ]
    },
    {
      "id": "T1.1",
      "phase": "F1",
      "mode": "otonom",
      "status": "tamam",
      "title": "Şema, migrasyonlar ve yalnızca-ekleme tetikleyicisi",
      "acceptance": "PGlite üzerinde migrasyonlar çalışır; custody_events UPDATE/DELETE reddedilir (test)",
      "evidence": "drizzle/0001_alan.sql (28 tablo) ve 0002_append_only.sql; tests/integration/append-only.test.ts 7/7: UPDATE, DELETE, cascade DELETE, izinsiz TRUNCATE ve aynı seq reddedilir; izinli demo sıfırlaması çalışır; tetikleyici bilerek bozulunca test düştü (1/7)",
      "depends_on": [
        "T0.5"
      ],
      "decisions": [
        "D-009",
        "D-012"
      ]
    },
    {
      "id": "T1.2",
      "phase": "F1",
      "mode": "otonom",
      "status": "tamam",
      "title": "Hesap çekirdeği: birim ve özellik testleri",
      "acceptance": "src/domain/calc kapsamı en az %90; para birimi ya da vergi temeli uyuşmazsa hata; boş girdi 'bilinmiyor' döner",
      "evidence": "tests/unit/calc: 27 test yeşil; rapor örneği birebir (10.000 / 31.111 / 17.500 TL, 222,50–271,11 TL/m², olumsuz −10.000); src/domain kapsamı %100 satır/dal/fonksiyon, eşik vitest.config.mts'te zorunlu; bilerek bozulan 4 değişikliğin 4'ü yakalandı",
      "depends_on": [
        "T0.5"
      ],
      "decisions": [
        "D-002",
        "D-011"
      ]
    },
    {
      "id": "T1.3",
      "phase": "F1",
      "mode": "otonom",
      "status": "tamam",
      "title": "Olay günlüğü, hash zinciri, kütle dengesi; sahte kayıt testi",
      "acceptance": "Değiştirilen bir olay verifyChain'de yakalanır; kütle dengesi toleransı testli",
      "evidence": "src/domain/traceability (canonical, chain, mass-balance, genealogy) ve src/db/repo/custody.ts. verifyChain: 500 rastgele zincirde 10 tür değişiklikte 0 kaçak, yer ve neden doğru; çapa sondan silmeyi ve kuyruğun yeniden yazılmasını yakalar. PGlite gidiş-dönüşü ve tetikleyiciyi atlayan saldırgan testi yeşil. Kütle dengesi %2 sınırı testli. Bilerek bozma: 15 değişikliğin 15i yakalandı; src/domain kapsamı %100",
      "depends_on": [
        "T1.1"
      ],
      "decisions": [
        "D-012"
      ]
    },
    {
      "id": "T1.4",
      "phase": "F1",
      "mode": "otonom",
      "status": "tamam",
      "title": "Sentetik seed (3 kaynak, 2 taşıyıcı, 2 alıcı, ReBoard) ve kaynaklı referans değerler",
      "acceptance": "Seed bütün tabloları doldurur; seed'deki her sayı resultClass taşır; demo kayıtlarının tamamı synthetic",
      "evidence": "src/db/seed/demo.ts (buildDemo(now): saf, deterministik) ve src/db/seed/index.ts (seedDemo: DEMO_MODE guard, tek işlemde TRUNCATE + ekleme). tests/integration/seed.test.ts 16/16: 28 tablodan invitation, session, verification dışındaki 25'i dolu; demo satırları synthetic, yalnız reference_values (6) ve saas_costs (3) sourced_estimate; 5 kurum zinciri DB'den okununca verifyChain ok; 5 üretim partisinin kütle dengesi tolerans içinde ya da açıklamalı (1 bilerek aşan); tahsis yalnız doğrulanmış ve üretimden önce gelen partilerden, kabul edilen kg'ı aşmadan. Bilerek bozma 2/2 yakalandı. pnpm db:seed yerel PGlite'a 366 satır yükledi. tests/unit/panel.test.ts 3/3 (levha 6,6978 m²). Toplam 147 test yeşil.",
      "depends_on": [
        "T1.1"
      ],
      "decisions": [
        "D-011"
      ]
    },
    {
      "id": "T1.5",
      "phase": "F1",
      "mode": "otonom",
      "status": "tamam",
      "title": "Kimlik, organizasyonlar ve roller, demo rol değiştirici; çapraz kiracı testleri",
      "acceptance": "A organizasyonunun kullanıcısı B'nin özel kayıtlarına 0 erişim (test)",
      "evidence": "Roller src/domain/access.ts (tek tablo), Better Auth rolleri ondan kurulur (src/lib/auth.ts; kayıt ve kurum açma kapalı, girişte etkin kurum). withTenant: src/db/repo/tenant.ts (22 tablo kataloğu, list/get/owns/assertOwns); membership.ts; viewer.ts (server-only); action.ts kapısı. Ekranlar: /giris (4 demo rolü, e-posta formu), (app)/panel, başlıkta rol değiştirici. tests/integration/tenant-isolation.test.ts 13/13: repository 3061 deneme 0 başarılı, HTTP 98 deneme 0 başarılı, bozma 9/9 yakalandı. auth-roles 2/2, access 7/7, action 4/4. Toplam 173 Vitest testi yeşil; src/domain kapsamı satır %95,96. tests/e2e/auth.spec.ts ve smoke: 25/25 (a11y 0 ciddi, 5 genişlikte taşma 0, dokunma hedefi < 44 px 0; bozma yakalandı). Canlı: Neon yeniden yüklendi (369 satır, 9 kullanıcı); Vercel'e DEMO_MODE ve gizli DEMO_PASSWORD eklendi; yayın reboard-ia91mcehs → reboard-lovat.vercel.app. Canlı denetim (GitHub Actions live-smoke 40454971234) 13/13 yeşil, demo girişi dahil; CI 40454965341 yeşil.",
      "depends_on": [
        "T1.1"
      ],
      "decisions": [
        "D-010",
        "D-016"
      ]
    },
    {
      "id": "T2.1",
      "phase": "F2",
      "mode": "otonom",
      "status": "tamam",
      "title": "Pazar yeri: ilan listesi, filtre, harita, detay, ilan oluşturma, teklif ve kabul",
      "acceptance": "E2E: sağlayıcı ilan verir, üretici teklif eder, sağlayıcı kabul eder, anlaşma ve teslim planı oluşur",